{
  "schema_version": "1.0",
  "updated_at": "2026-08-10",
  "evidence_notice": "All current records are approved for scenario discovery only. evidence_level=specification is not a verified product demonstration or customer outcome.",
  "showcases": [
    {
      "id": "customer-meeting-to-cited-brief",
      "title": "Turn a customer meeting into a cited operating brief",
      "description": "Combine a synthetic meeting recording and governed company context into a source-labelled operating brief.",
      "category": "customer-relationships",
      "status": "needs-rework",
      "evidence_level": "specification",
      "data_kind": "synthetic",
      "expected_result": "A private brief separating confirmed facts, targets, boundaries, and dated follow-ups, with no external action.",
      "capabilities": ["recordings", "transcription", "shared-context", "pages", "citations"],
      "tags": ["meeting", "customer", "brief", "citations", "follow-up", "synthetic"],
      "record_path": "customer-meeting-to-cited-brief.md",
      "last_verified": "2026-08-09",
      "public_approval": {"approved": true, "approved_at": "2026-08-10", "scope": "scenario-discovery-only"},
      "media": {"video_url": null, "poster_url": null}
    },
    {
      "id": "weekly-inputs-to-exception-brief",
      "title": "Turn three weekly updates into one exception brief",
      "description": "Compare synthetic store updates and surface urgent exceptions, cross-store patterns, and decisions needed.",
      "category": "operations",
      "status": "prepared",
      "evidence_level": "specification",
      "data_kind": "synthetic",
      "expected_result": "A source-labelled exception brief that prioritizes cold-room risk and repeated stockouts without inventing owners or tasks.",
      "capabilities": ["workspace-files", "multi-source-synthesis", "pages", "citations"],
      "tags": ["operations", "weekly-report", "exceptions", "retail", "management", "synthetic"],
      "record_path": "weekly-inputs-to-exception-brief.md",
      "public_approval": {"approved": true, "approved_at": "2026-08-10", "scope": "scenario-discovery-only"},
      "media": {"video_url": null, "poster_url": null}
    },
    {
      "id": "pipeline-to-follow-up-plan",
      "title": "Turn a small pipeline into a prioritized follow-up plan",
      "description": "Combine a synthetic pipeline snapshot and qualification notes into an evidence-led review order.",
      "category": "sales",
      "status": "prepared",
      "evidence_level": "specification",
      "data_kind": "synthetic",
      "expected_result": "A ranked follow-up plan driven by commitments and risk rather than deal size, with no outreach sent.",
      "capabilities": ["crm", "workspace-files", "prioritization", "pages"],
      "tags": ["sales", "pipeline", "crm", "follow-up", "prioritization", "synthetic"],
      "record_path": "pipeline-to-follow-up-plan.md",
      "public_approval": {"approved": true, "approved_at": "2026-08-10", "scope": "scenario-discovery-only"},
      "media": {"video_url": null, "poster_url": null}
    },
    {
      "id": "opportunity-to-proposal-draft",
      "title": "Turn a qualified opportunity into a bounded proposal draft",
      "description": "Apply a governed synthetic offer to a qualified opportunity without inventing price, scope, or commitments.",
      "category": "sales",
      "status": "prepared",
      "evidence_level": "specification",
      "data_kind": "synthetic",
      "expected_result": "A private proposal draft with exact scope, fee, exclusions, dependencies, and founder-approval status.",
      "capabilities": ["workspace-files", "shared-context", "drafting", "pages"],
      "tags": ["sales", "proposal", "commercial", "approvals", "pilot", "synthetic"],
      "record_path": "opportunity-to-proposal-draft.md",
      "public_approval": {"approved": true, "approved_at": "2026-08-10", "scope": "scenario-discovery-only"},
      "media": {"video_url": null, "poster_url": null}
    },
    {
      "id": "scattered-notes-to-operating-sop",
      "title": "Turn scattered onboarding notes into one operating SOP",
      "description": "Reconcile synthetic founder, operator, and retrospective notes into one governed onboarding process.",
      "category": "team-operations",
      "status": "prepared",
      "evidence_level": "specification",
      "data_kind": "synthetic",
      "expected_result": "A day-based SOP with roles, approvals, sources, safety boundaries, and unresolved questions.",
      "capabilities": ["workspace-files", "multi-source-synthesis", "shared-context", "pages"],
      "tags": ["onboarding", "sop", "team-operations", "knowledge", "governance", "synthetic"],
      "record_path": "scattered-notes-to-operating-sop.md",
      "public_approval": {"approved": true, "approved_at": "2026-08-10", "scope": "scenario-discovery-only"},
      "media": {"video_url": null, "poster_url": null}
    },
    {
      "id": "weekly-metrics-to-executive-update",
      "title": "Turn weekly metrics and notes into an executive update",
      "description": "Combine synthetic metrics and operating notes into a concise, decision-oriented management update.",
      "category": "leadership",
      "status": "prepared",
      "evidence_level": "specification",
      "data_kind": "synthetic",
      "expected_result": "An update separating actuals, targets, interpretations, risks, and decisions with visible calculations.",
      "capabilities": ["workspace-files", "csv", "arithmetic", "analysis", "pages"],
      "tags": ["leadership", "metrics", "executive-update", "analysis", "decisions", "synthetic"],
      "record_path": "weekly-metrics-to-executive-update.md",
      "public_approval": {"approved": true, "approved_at": "2026-08-10", "scope": "scenario-discovery-only"},
      "media": {"video_url": null, "poster_url": null}
    },
    {
      "id": "support-tickets-to-triage-brief",
      "title": "Turn support tickets into a prioritized triage brief",
      "description": "Group synthetic support tickets and distinguish likely defects from expected governed behavior.",
      "category": "customer-success",
      "status": "prepared",
      "evidence_level": "specification",
      "data_kind": "synthetic",
      "expected_result": "An evidence-led triage order that prioritizes repeated access failures without replying or creating incidents.",
      "capabilities": ["workspace-files", "issue-grouping", "prioritization", "pages"],
      "tags": ["support", "triage", "customer-success", "tickets", "incidents", "synthetic"],
      "record_path": "support-tickets-to-triage-brief.md",
      "public_approval": {"approved": true, "approved_at": "2026-08-10", "scope": "scenario-discovery-only"},
      "media": {"video_url": null, "poster_url": null}
    },
    {
      "id": "customer-feedback-to-product-themes",
      "title": "Turn customer feedback into evidence-backed product themes",
      "description": "Group a synthetic feedback sample into cited themes while preserving counter-evidence and uncertainty.",
      "category": "product",
      "status": "prepared",
      "evidence_level": "specification",
      "data_kind": "synthetic",
      "expected_result": "A theme table with exact sample counts, feedback IDs, counter-evidence, and unanswered questions.",
      "capabilities": ["workspace-files", "thematic-analysis", "counting", "pages"],
      "tags": ["product", "feedback", "research", "themes", "evidence", "synthetic"],
      "record_path": "customer-feedback-to-product-themes.md",
      "public_approval": {"approved": true, "approved_at": "2026-08-10", "scope": "scenario-discovery-only"},
      "media": {"video_url": null, "poster_url": null}
    },
    {
      "id": "renewal-account-to-risk-brief",
      "title": "Turn account signals into a renewal risk brief",
      "description": "Balance synthetic usage, stakeholder, security, and renewal signals without inventing churn probability.",
      "category": "customer-success",
      "status": "prepared",
      "evidence_level": "specification",
      "data_kind": "synthetic",
      "expected_result": "A risk brief separating healthy adoption from stakeholder and security dependencies.",
      "capabilities": ["account-signals", "analysis", "arithmetic", "pages"],
      "tags": ["renewal", "customer-success", "account-health", "risk", "usage", "synthetic"],
      "record_path": "renewal-account-to-risk-brief.md",
      "public_approval": {"approved": true, "approved_at": "2026-08-10", "scope": "scenario-discovery-only"},
      "media": {"video_url": null, "poster_url": null}
    },
    {
      "id": "job-posting-to-outcome-demo-plan",
      "title": "Turn a job posting into an outcome-led demo plan",
      "description": "Convert a synthetic hiring signal into an evidence-bounded custom demo direction without a replacement claim.",
      "category": "go-to-market",
      "status": "prepared",
      "evidence_level": "specification",
      "data_kind": "synthetic",
      "expected_result": "A demo plan separating job evidence, assumptions, discovery questions, and the smallest outcome proof.",
      "capabilities": ["workspace-files", "signal-analysis", "planning", "pages"],
      "tags": ["jobsdb", "hiring-signal", "go-to-market", "demo", "discovery", "synthetic"],
      "record_path": "job-posting-to-outcome-demo-plan.md",
      "public_approval": {"approved": true, "approved_at": "2026-08-10", "scope": "scenario-discovery-only"},
      "media": {"video_url": null, "poster_url": null}
    },
    {
      "id": "prospect-pack-to-discovery-brief",
      "title": "Turn a prospect pack into a discovery brief",
      "description": "Turn permitted synthetic prospect sources into facts, hypotheses, discovery questions, and a tailored demo direction.",
      "category": "sales",
      "status": "prepared",
      "evidence_level": "specification",
      "data_kind": "synthetic",